{
  "schemaVersion": "1.0",
  "id": "sentence-n4-experience",
  "type": "sentence",
  "title": "N4 体验句子",
  "description": "GitHub 体验版 N4 常用句子，共 30 条。",
  "sourceLanguage": "ja",
  "license": "Generated sample content for JPexam GitHub experience edition.",
  "source": "JPexam generated experience pack",
  "createdAt": "2026-09-10",
  "items": [
    {
      "id": "sentence-n4-experience-001",
      "type": "sentence",
      "jp": "明日までに予定を確認します。",
      "kana": "あしたまでによていをかくにんします。",
      "zh": "在明天之前确认计划。",
      "level": "N4",
      "tags": [
        "计划",
        "动作"
      ],
      "reading": [
        {
          "text": "明日",
          "kana": "あした"
        },
        {
          "text": "予定",
          "kana": "よてい"
        },
        {
          "text": "確認します",
          "kana": "かくにんします"
        }
      ]
    },
    {
      "id": "sentence-n4-experience-002",
      "type": "sentence",
      "jp": "授業の前までに約束を準備します。",
      "kana": "じゅぎょうのまえまでにやくそくをじゅんびします。",
      "zh": "在上课前之前准备约定。",
      "level": "N4",
      "tags": [
        "计划",
        "动作"
      ],
      "reading": [
        {
          "text": "授業の前",
          "kana": "じゅぎょうのまえ"
        },
        {
          "text": "約束",
          "kana": "やくそく"
        },
        {
          "text": "準備します",
          "kana": "じゅんびします"
        }
      ]
    },
    {
      "id": "sentence-n4-experience-003",
      "type": "sentence",
      "jp": "明日までに宿題を片付けます。",
      "kana": "あしたまでにしゅくだいをかたづけます。",
      "zh": "在明天之前整理作业。",
      "level": "N4",
      "tags": [
        "计划",
        "动作"
      ],
      "reading": [
        {
          "text": "明日",
          "kana": "あした"
        },
        {
          "text": "宿題",
          "kana": "しゅくだい"
        },
        {
          "text": "片付けます",
          "kana": "かたづけます"
        }
      ]
    },
    {
      "id": "sentence-n4-experience-004",
      "type": "sentence",
      "jp": "授業の前までに資料を調べます。",
      "kana": "じゅぎょうのまえまでにしりょうをしらべます。",
      "zh": "在上课前之前查询资料。",
      "level": "N4",
      "tags": [
        "计划",
        "动作"
      ],
      "reading": [
        {
          "text": "授業の前",
          "kana": "じゅぎょうのまえ"
        },
        {
          "text": "資料",
          "kana": "しりょう"
        },
        {
          "text": "調べます",
          "kana": "しらべます"
        }
      ]
    },
    {
      "id": "sentence-n4-experience-005",
      "type": "sentence",
      "jp": "明日までに部屋を説明します。",
      "kana": "あしたまでにへやをせつめいします。",
      "zh": "在明天之前说明房间。",
      "level": "N4",
      "tags": [
        "计划",
        "动作"
      ],
      "reading": [
        {
          "text": "明日",
          "kana": "あした"
        },
        {
          "text": "部屋",
          "kana": "へや"
        },
        {
          "text": "説明します",
          "kana": "せつめいします"
        }
      ]
    },
    {
      "id": "sentence-n4-experience-006",
      "type": "sentence",
      "jp": "授業の前までに予定を確認します。",
      "kana": "じゅぎょうのまえまでによていをかくにんします。",
      "zh": "在上课前之前确认计划。",
      "level": "N4",
      "tags": [
        "计划",
        "动作"
      ],
      "reading": [
        {
          "text": "授業の前",
          "kana": "じゅぎょうのまえ"
        },
        {
          "text": "予定",
          "kana": "よてい"
        },
        {
          "text": "確認します",
          "kana": "かくにんします"
        }
      ]
    },
    {
      "id": "sentence-n4-experience-007",
      "type": "sentence",
      "jp": "明日までに約束を準備します。",
      "kana": "あしたまでにやくそくをじゅんびします。",
      "zh": "在明天之前准备约定。",
      "level": "N4",
      "tags": [
        "计划",
        "动作"
      ],
      "reading": [
        {
          "text": "明日",
          "kana": "あした"
        },
        {
          "text": "約束",
          "kana": "やくそく"
        },
        {
          "text": "準備します",
          "kana": "じゅんびします"
        }
      ]
    },
    {
      "id": "sentence-n4-experience-008",
      "type": "sentence",
      "jp": "授業の前までに宿題を片付けます。",
      "kana": "じゅぎょうのまえまでにしゅくだいをかたづけます。",
      "zh": "在上课前之前整理作业。",
      "level": "N4",
      "tags": [
        "计划",
        "动作"
      ],
      "reading": [
        {
          "text": "授業の前",
          "kana": "じゅぎょうのまえ"
        },
        {
          "text": "宿題",
          "kana": "しゅくだい"
        },
        {
          "text": "片付けます",
          "kana": "かたづけます"
        }
      ]
    },
    {
      "id": "sentence-n4-experience-009",
      "type": "sentence",
      "jp": "明日までに資料を調べます。",
      "kana": "あしたまでにしりょうをしらべます。",
      "zh": "在明天之前查询资料。",
      "level": "N4",
      "tags": [
        "计划",
        "动作"
      ],
      "reading": [
        {
          "text": "明日",
          "kana": "あした"
        },
        {
          "text": "資料",
          "kana": "しりょう"
        },
        {
          "text": "調べます",
          "kana": "しらべます"
        }
      ]
    },
    {
      "id": "sentence-n4-experience-010",
      "type": "sentence",
      "jp": "授業の前までに部屋を説明します。",
      "kana": "じゅぎょうのまえまでにへやをせつめいします。",
      "zh": "在上课前之前说明房间。",
      "level": "N4",
      "tags": [
        "计划",
        "动作"
      ],
      "reading": [
        {
          "text": "授業の前",
          "kana": "じゅぎょうのまえ"
        },
        {
          "text": "部屋",
          "kana": "へや"
        },
        {
          "text": "説明します",
          "kana": "せつめいします"
        }
      ]
    },
    {
      "id": "sentence-n4-experience-011",
      "type": "sentence",
      "jp": "明日までに予定を確認します。",
      "kana": "あしたまでによていをかくにんします。",
      "zh": "在明天之前确认计划。",
      "level": "N4",
      "tags": [
        "计划",
        "动作"
      ],
      "reading": [
        {
          "text": "明日",
          "kana": "あした"
        },
        {
          "text": "予定",
          "kana": "よてい"
        },
        {
          "text": "確認します",
          "kana": "かくにんします"
        }
      ]
    },
    {
      "id": "sentence-n4-experience-012",
      "type": "sentence",
      "jp": "授業の前までに約束を準備します。",
      "kana": "じゅぎょうのまえまでにやくそくをじゅんびします。",
      "zh": "在上课前之前准备约定。",
      "level": "N4",
      "tags": [
        "计划",
        "动作"
      ],
      "reading": [
        {
          "text": "授業の前",
          "kana": "じゅぎょうのまえ"
        },
        {
          "text": "約束",
          "kana": "やくそく"
        },
        {
          "text": "準備します",
          "kana": "じゅんびします"
        }
      ]
    },
    {
      "id": "sentence-n4-experience-013",
      "type": "sentence",
      "jp": "明日までに宿題を片付けます。",
      "kana": "あしたまでにしゅくだいをかたづけます。",
      "zh": "在明天之前整理作业。",
      "level": "N4",
      "tags": [
        "计划",
        "动作"
      ],
      "reading": [
        {
          "text": "明日",
          "kana": "あした"
        },
        {
          "text": "宿題",
          "kana": "しゅくだい"
        },
        {
          "text": "片付けます",
          "kana": "かたづけます"
        }
      ]
    },
    {
      "id": "sentence-n4-experience-014",
      "type": "sentence",
      "jp": "授業の前までに資料を調べます。",
      "kana": "じゅぎょうのまえまでにしりょうをしらべます。",
      "zh": "在上课前之前查询资料。",
      "level": "N4",
      "tags": [
        "计划",
        "动作"
      ],
      "reading": [
        {
          "text": "授業の前",
          "kana": "じゅぎょうのまえ"
        },
        {
          "text": "資料",
          "kana": "しりょう"
        },
        {
          "text": "調べます",
          "kana": "しらべます"
        }
      ]
    },
    {
      "id": "sentence-n4-experience-015",
      "type": "sentence",
      "jp": "明日までに部屋を説明します。",
      "kana": "あしたまでにへやをせつめいします。",
      "zh": "在明天之前说明房间。",
      "level": "N4",
      "tags": [
        "计划",
        "动作"
      ],
      "reading": [
        {
          "text": "明日",
          "kana": "あした"
        },
        {
          "text": "部屋",
          "kana": "へや"
        },
        {
          "text": "説明します",
          "kana": "せつめいします"
        }
      ]
    },
    {
      "id": "sentence-n4-experience-016",
      "type": "sentence",
      "jp": "授業の前までに予定を確認します。",
      "kana": "じゅぎょうのまえまでによていをかくにんします。",
      "zh": "在上课前之前确认计划。",
      "level": "N4",
      "tags": [
        "计划",
        "动作"
      ],
      "reading": [
        {
          "text": "授業の前",
          "kana": "じゅぎょうのまえ"
        },
        {
          "text": "予定",
          "kana": "よてい"
        },
        {
          "text": "確認します",
          "kana": "かくにんします"
        }
      ]
    },
    {
      "id": "sentence-n4-experience-017",
      "type": "sentence",
      "jp": "明日までに約束を準備します。",
      "kana": "あしたまでにやくそくをじゅんびします。",
      "zh": "在明天之前准备约定。",
      "level": "N4",
      "tags": [
        "计划",
        "动作"
      ],
      "reading": [
        {
          "text": "明日",
          "kana": "あした"
        },
        {
          "text": "約束",
          "kana": "やくそく"
        },
        {
          "text": "準備します",
          "kana": "じゅんびします"
        }
      ]
    },
    {
      "id": "sentence-n4-experience-018",
      "type": "sentence",
      "jp": "授業の前までに宿題を片付けます。",
      "kana": "じゅぎょうのまえまでにしゅくだいをかたづけます。",
      "zh": "在上课前之前整理作业。",
      "level": "N4",
      "tags": [
        "计划",
        "动作"
      ],
      "reading": [
        {
          "text": "授業の前",
          "kana": "じゅぎょうのまえ"
        },
        {
          "text": "宿題",
          "kana": "しゅくだい"
        },
        {
          "text": "片付けます",
          "kana": "かたづけます"
        }
      ]
    },
    {
      "id": "sentence-n4-experience-019",
      "type": "sentence",
      "jp": "明日までに資料を調べます。",
      "kana": "あしたまでにしりょうをしらべます。",
      "zh": "在明天之前查询资料。",
      "level": "N4",
      "tags": [
        "计划",
        "动作"
      ],
      "reading": [
        {
          "text": "明日",
          "kana": "あした"
        },
        {
          "text": "資料",
          "kana": "しりょう"
        },
        {
          "text": "調べます",
          "kana": "しらべます"
        }
      ]
    },
    {
      "id": "sentence-n4-experience-020",
      "type": "sentence",
      "jp": "授業の前までに部屋を説明します。",
      "kana": "じゅぎょうのまえまでにへやをせつめいします。",
      "zh": "在上课前之前说明房间。",
      "level": "N4",
      "tags": [
        "计划",
        "动作"
      ],
      "reading": [
        {